Title,Paragraph,Sentiment,Status,Summary,Image URL
,"Sanwo-Olu, an exemplary public sector reformer and astute politician, known for his love and passion for the public service, has shown leadership in Lagos by giving the electorate a great deal in steering the ship of the nation’s commercial city in the right direction.
As the 15th Lagos governor, and having worked closely with three previous governors – Asiwaju Bola Tinubu, Babatunde Raji Fashola, and Akinwunmi Ambode in different capacities, Sanwo-Olu understands the state and the various challenges facing the mega city. His knowledge of challenges confronting residents made his administration adopt a six pillars policy programme tagged “T.H.E.M.E.S’’ in solving the identified problems through good governance. The six pillars are; Traffic Management and Transportation; Health and Environment; Education and Technology; Making Lagos a 21st Century state; Entertainment and Tourism; Security and Governance. Each of these six pillars is carefully thought-out as the government’s priorities in delivering solutions across sectors.
 
Sanwo-Olu, in his speech at the swearing-in on May 29, 2019, spoke passionately about his plans for the state, especially his dream of building a greater Lagos. This passion seemed to have motivated his quest for good governance. The governor, without any iota of doubt, has delivered significantly on his campaign promises during his first term in office. His achievements are visible in different sectors and have been commended by people within and outside the state.
A little above seven months when the Sanwo-Olu administration had barely settled down, COVID-19 pandemic ravaged the entire world and Lagos became an epicentre of the airborne disease. The governor showed leadership in rising up to the occasion and responding to the pandemic. As Incident Commander, he protected the citizens of the state by ensuring that the ravaging infection was well managed.
Sanwo-Olu, with the assistance of his Commissioner for Health, Prof. Akin Abayomi, and other stakeholders controlled the spread and ensured that those who contracted the virus were well attended to. He was the first governor to come up with a clearly defined containment strategy and response, which was later adopted by the presidency for the national response plan.  This intervention by the Sanwo-Olu administration made Nigeria the fourth best country in the world which impressively curbed the spread of the COVID-19 virus according to the World Health Organisation.      
Sanwo-Olu also displayed great leadership during the #EndSARS demonstration, a youth-motivated civil action against police brutality, which was later hijacked by hoodlums. The campaign, which started peacefully, turned violent after it was hijacked, leading to violence and destruction of private and public property in Lagos State. Rather than allowing Lagos to be brought to its knees by the ugly incident, Sanwo-Olu rose up to the challenge by championing the “Rebuild Lagos” plan.
The administration’s traffic management and transportation blueprint has significantly brought the dream of Lagos to have an efficient and reliable intermodal system of transportation to a reality. Sanwo-Olu’ government has invested hugely in waterways and a light rail system as alternatives to road transportation.
The governor’s administration started the 37-km Red Line rail project from scratch and the project is at completion stage. At full operation, the Red Line will move about a million passengers daily. The administration also injected huge resources into the 13-km Blue Line rail, commissioned in January by the President, (Major General) Muhammadu Buhari (retd), to ensure mass mobility from Mile 2 axis into the Island.
To ease traffic gridlock in the metropolis, Sanwo-Olu’s administration built and completed Agege-Pen Cinema dual carriage flyover with adjoining roads in Agege, and also commissioned the Lagos-Ogun network of roads with bridge in Agbado-Oke Odo Local Council Development Area. He also carried out junction improvements and reconfiguration at the 18 traffic spots, including first and second Lekki Roundabouts, Allen Avenue, Ajah and Igando. All these are done to reduce traffic gridlock in the state.
In the last three and half years, the governor has constructed and rehabilitated over 1,000 roads while others are at various stages of completion. The plan for construction of the 4th Mainland Bridge is also on course. The incumbent administration also started the Opebi-Ojota Link Bridge, which is expected to be completed this year. The First phase of the six-lane rigid-pavement 18.75km Lekki-Epe Expressway, stretching from Eleko Junction all the way to Epe T-junction, is completed and delivered to the good people of Lagos residing in the Lekki-Epe axis. The Sanwo-Olu administration has also provided thousands of LAGRIDE cars, First and Last Mile buses, and large capacity buses and boats for waterways to ease transportation in Lagos.
Sanwo-Olu believes no resources should be spared in providing quality health care to the residents, which is why the state government delivered secondary health facilities, such as Mother and Child Centres in Eti-Osa, Igando, Epe and Badagry. The Lagos government is building New Massey Children Hospital, which will be the biggest children hospital in West Africa. There is also an ongoing construction of General Hospital in Ojo and development of a mental health facility in Ketu Ejinrin.  Related News   Lagos retirees got pension in Q4 2022 — Govt  Seven gov candidates, nine parties endorse Sanwo-Olu  LASG trains 4,260 filmmakers   
To address waste management and environmental issues in Lagos, the Sanwo-Olu administration is working hard to rid the state of flood. The state government has carried out extensive dredging and desilting on many secondary and tertiary drainage channels across the state.        
Sanwo-Olu’s administration has made a lot of investments in education and technology in Lagos by building thousands of classrooms and providing 380,000 units of composite furniture for the students. Among the iconic school projects built by the Sanwo-Olu government are the new Elemoro Community Junior Secondary School, Ibeju-Lekki, and the containerised modular classroom block in Vetland Junior Grammar School, Agege. The governor has also rewarded 13 outstanding teachers with new vehicles on two occasions.
The administration has equally made remarkable inroad in the training of teachers for 21st-century competence. It is of note that through the EKO EXCEL training initiative, more than 3,000 primary school teachers have been trained on how to competently utilise technology in teaching, for better educational outcomes for our children. The government has also paid the WAEC fees of all students in the state’s public secondary schools to date.
The Lagos State Polytechnic and Lagos State College of Education have been upgraded to universities. Lagos now has three state-owned universities, courtesy of Sanwo-Olu’s education reforms. It should be noted that there have been no disruption of academic activities across Lagos’ tertiary institutions since Sanwo-Olu took over; all issues that relate to students, staff and lecturers’ welfare are promptly attended to.
One of the cardinal programmes of the governor is making Lagos a 21st-century economy. In this regard, Sanwo-Olu has recorded a milestone in provision of requisite infrastructure. The recent handover of the Lekki Deep Seaport project is a pointer to this. Lagos has also secured an approval for the development of Badagry Port and an international airport in Lekki. All of these will boost Lagos’ economy when completed.
The governor has also made significant progress in the housing sector, as the administration commissioned over 7,000 flats in about 17 housing units in different parts of the state in the last three and half years, while more housing schemes are expected to be delivered in the coming months.
The Sanwo-Olu administration has done so much in the area of agriculture and food security, with initiatives such as the Agro Processing, Productivity Enhancement and Livelihood Improvement Support project, designed to build the capacity of players in the rice, aquaculture and poultry value chains. The government has also strengthened the capacity of farmers through the Lagos Agripreneurship Programme, the Sea Food Festival and the Eko City Farmers Food Market.
Above all, Sanwo-Olu has completed and delivered the all-important Lagos Rice Mill, Imota, Ikorodu. This rice mill will inject over 250,000 direct and indirect jobs into employment space for the youth.      
Safety is key for development. The governor recently commissioned three newly built fire stations and 62 fire fighting equipment. Sanwo-Olu has also made significant developments in entertainment and tourism, being the fifth pillar of his administration’s THEMES agenda. He has supported the creative industry across youth-centric initiatives, among which are the building of a film city and the release of N1bn seed capital to support the creative sector in Lagos.
As of today, over 3,000 youths have been trained and empowered by the Lagos State Government in partnership with the Africa Film Academy, Del-York Films Academy and EbonyLife Studios.
On security and governance, the administration’s goal is transformational security, using cutting-edge technology. To achieve this, the state government is building a Command-and-Control Centre to efficiently monitor security in the metropolis, while investing heavily in security cameras, data-gathering and processing in order to stay permanently ahead of crime and criminality.
Sanwo-Olu has made Lagos safe and secure through investment in security, which is the reason crime reduced drastically, making Lagos the safest state in Nigeria. The government’s decision to ban motorcycles and tricycles on highways and some roads within the state has also led to a reduction in accident victims in the state.
Sanwo-Olu has, without doubt, taken governance to a whole new level during his first term. Therefore, his re-election campaign has been based on his sterling performance and hands-on experience. He has delivered on many of his campaign promises and certainly deserves the vote of every forward-looking Lagosian who thinks more about the development of the state.

 Akosile is the Chief Press Secretary to Governor Sanwo-Olu",0.15083093843598047,Positive,,
Protest rocks Kwara local football council election,"Some members of the Kwara State FA have protested their disqualification from the upcoming local football council elections, which will hold March 21, The PUNCH reports.
Following the order of the Nigeria Football Federation to state football associations to conduct elections into their respective local football councils as a prelude to the state elections, the Kwara FA constituted a committee headed by a former chairman, Saliu Ojibara.
However, four local councils — Asa, Ifelodun, Ilorin West and Moro — were allegedly prevented from the process due to non-payment of affiliation fees as well as incomplete electorate list, meaning that every aspirant from the local councils could not take part in the elections.
As a result, interim committees were sworn in on Sunday to take charge of the local councils and ensure all conditions for elections were met in 30 days, while elections into the other local councils would go on as scheduled.
 
One of the affected aspirants, who is currently the caretaker Chairman of Ilorin West Local Council, Yahaya Yar’adua, claimed he wasn’t aware of such payment.  Related News   Kwara health workers demand better welfare  Vote Abdulrazaq, Olawepo-Hashim appeals to Kwara stakeholders  Sergeant guns down lover, kills self in Kwara   
“It’s not up to a year that I’ve been in charge and the FA had not written to us about such before until the election. In fact, we were not even told during the screening, we just read it on the group chat after we had gone for screening that our local football councils won’t participate in the elections,” Yar’adua said.
Another affected aspirant from Asa local council, Ibraheem Ajao, noted that the moves were all schemes of the current Kwara FA chairman to ensure his return for a second term.      
“All the four local councils that are affected are the ones the chairman knows won’t support his second term.”
Chairman of the electoral committee, Saliu Ojibara, noted that the body followed the electoral guidelines during the process that led to the disqualification of the councils.
“This is the first time we are having local council elections and we are applying the electoral guidelines which is available for all the members. There are still room for them to regularise and fulfil their conditions, but if they can’t do that within the stipulated time, a bye-election will be conducted after this.”",0.030842911877394637,Positive,"Some members of the Kwara State FA have protested their disqualification from the upcoming local football council elections, which will hold March 21, The PUNCH reports.
Following the order of the Nigeria Football Federation to state football associations to conduct elections into their respective local football councils as a prelude to the state elections, the Kwara FA constituted a committee headed by a former chairman, Saliu Ojibara.
One of the affected aspirants, who is currently the caretaker Chairman of Ilorin West Local Council, Yahaya Yar’adua, claimed he wasn’t aware of such payment.
Another affected aspirant from Asa local council, Ibraheem Ajao, noted that the moves were all schemes of the current Kwara FA chairman to ensure his return for a second term.
“This is the first time we are having local council elections and we are applying the electoral guidelines which is available for all the members.",https://cdn.punchng.com/wp-content/uploads/2021/05/16175056/IMG-20210516-WA0002.jpg
,"Following the order of the Nigeria Football Federation to state football associations to conduct elections into their respective local football councils as a prelude to the state elections, the Kwara FA constituted a committee headed by a former chairman, Saliu Ojibara.
However, four local councils — Asa, Ifelodun, Ilorin West and Moro — were allegedly prevented from the process due to non-payment of affiliation fees as well as incomplete electorate list, meaning that every aspirant from the local councils could not take part in the elections.
As a result, interim committees were sworn in on Sunday to take charge of the local councils and ensure all conditions for elections were met in 30 days, while elections into the other local councils would go on as scheduled.
 
One of the affected aspirants, who is currently the caretaker Chairman of Ilorin West Local Council, Yahaya Yar’adua, claimed he wasn’t aware of such payment.  Related News   Kwara health workers demand better welfare  Vote Abdulrazaq, Olawepo-Hashim appeals to Kwara stakeholders  Sergeant guns down lover, kills self in Kwara   
“It’s not up to a year that I’ve been in charge and the FA had not written to us about such before until the election. In fact, we were not even told during the screening, we just read it on the group chat after we had gone for screening that our local football councils won’t participate in the elections,” Yar’adua said.
Another affected aspirant from Asa local council, Ibraheem Ajao, noted that the moves were all schemes of the current Kwara FA chairman to ensure his return for a second term.      
“All the four local councils that are affected are the ones the chairman knows won’t support his second term.”
Chairman of the electoral committee, Saliu Ojibara, noted that the body followed the electoral guidelines during the process that led to the disqualification of the councils.
“This is the first time we are having local council elections and we are applying the electoral guidelines which is available for all the members. There are still room for them to regularise and fulfil their conditions, but if they can’t do that within the stipulated time, a bye-election will be conducted after this.”",0.03194444444444445,Positive,,
,"However, four local councils — Asa, Ifelodun, Ilorin West and Moro — were allegedly prevented from the process due to non-payment of affiliation fees as well as incomplete electorate list, meaning that every aspirant from the local councils could not take part in the elections.
As a result, interim committees were sworn in on Sunday to take charge of the local councils and ensure all conditions for elections were met in 30 days, while elections into the other local councils would go on as scheduled.
 
One of the affected aspirants, who is currently the caretaker Chairman of Ilorin West Local Council, Yahaya Yar’adua, claimed he wasn’t aware of such payment.  Related News   Kwara health workers demand better welfare  Vote Abdulrazaq, Olawepo-Hashim appeals to Kwara stakeholders  Sergeant guns down lover, kills self in Kwara   
“It’s not up to a year that I’ve been in charge and the FA had not written to us about such before until the election. In fact, we were not even told during the screening, we just read it on the group chat after we had gone for screening that our local football councils won’t participate in the elections,” Yar’adua said.
Another affected aspirant from Asa local council, Ibraheem Ajao, noted that the moves were all schemes of the current Kwara FA chairman to ensure his return for a second term.      
“All the four local councils that are affected are the ones the chairman knows won’t support his second term.”
Chairman of the electoral committee, Saliu Ojibara, noted that the body followed the electoral guidelines during the process that led to the disqualification of the councils.
“This is the first time we are having local council elections and we are applying the electoral guidelines which is available for all the members. There are still room for them to regularise and fulfil their conditions, but if they can’t do that within the stipulated time, a bye-election will be conducted after this.”",0.03726851851851852,Positive,,
"February elections consolidated Nigeria’s democracy, Presidency replies critics","The Presidency on Monday evening said the Presidential and National Assembly elections of February 25 has consolidated Nigeria’s democracy and improved the integrity of the Electoral Act 2022.
It also argued that as much as international observers faulted the irregularities witnessed in the collation of results, due credit must be given to the efforts of the Buhari regime to ensure free and fair polls.
“Though it is true there were some delays and technical faults in the process that we can learn from – as is the case in any election the world over – the vote progressed and consolidated democracy in Nigeria,” a statement signed by the President’s spokesman, Garba Shehu, read late Monday.
The statement is titled ‘February 25 presidential election is a marked improvement on past elections, the world should note this.’
 
It noted that the adversities faced in some quarters are all part of the learning process for Nigerians, the government and the Independent National Electoral Commission.
“No one has disputed the result of the election, except the candidates that fell short. The biggest and the most competitive presidential election in the history of Nigeria has been won by one man: Asiwaju Bola Ahmed Tinubu.
“The US State department congratulated President-elect Bola Tinubu of the governing All Progressives Congress, APC and the people of Nigeria on the outcome of the ‘competitive election.’ British Prime Minister, Rishi Sunak, was also quick to congratulate the winner, on this victory. And so did many others in ECOWAS and the African Union.      
“Though it is true there were some delays and technical faults in the process that we can learn from – as is the case in any election the world over – the vote progressed and consolidated democracy in Nigeria,” Shehu wrote.
The Presidency argued that the integrity of the Electoral Act of 2022 was strengthened as it paved the way for the Bimodal Voter Accreditation System which, it claimed, cut out ghost, unauthorised or multiple votes to stem fraud.  Related News   In true democracies, political structures don’t win elections  Presidential poll: Obi makes U-turn, says he'll challenge process, outcome  Election: God's wish is doing right thing, says Obi   
“The election may not have been pluperfect, but due to the steps the government has taken, it is an improvement on previous polls.
“That achievement should not be overlooked. The next step is for the Election Commission to ensure transparency in collation.
“Adverse reactions as received from some quarters are themselves a part of the learning process for everyone,” it said.
The Presidency also maintained that despite the “epic lies, obfuscation, jingoism and hate, and told by global media” Nigerians shocked the world by refusing religious hatred and sectarian politics.
Therefore, all true friends of Nigeria should join the people in proceeding forward for sustainable peace.        
It also noted that the “APC victory in the presidential election, underscored by the nationwide wave of support in the National Assembly results is clear mandate for the party to retain power for another term of four years.
“This election is an improvement on past elections and due credit should be given to the government and people of this country.”
The Presidency thanked former ambassadors Mark Green and Johnnie Carson – along with other foreign observers – for their concerns over the logistics of the recent general election in Nigeria and their work as observers on the National Democratic Institute/International Republican Institute Election Observation Missions.",0.04708049886621315,Positive,"The Presidency on Monday evening said the Presidential and National Assembly elections of February 25 has consolidated Nigeria’s democracy and improved the integrity of the Electoral Act 2022.
The biggest and the most competitive presidential election in the history of Nigeria has been won by one man: Asiwaju Bola Ahmed Tinubu.
“The election may not have been pluperfect, but due to the steps the government has taken, it is an improvement on previous polls.
“Adverse reactions as received from some quarters are themselves a part of the learning process for everyone,” it said.
Therefore, all true friends of Nigeria should join the people in proceeding forward for sustainable peace.",https://cdn.punchng.com/wp-content/uploads/2022/05/17001759/2023-ELECTION.jpg
